{
  "runId": "run-junichiro-v1",
  "projectId": "junichiro-jackson",
  "sequence": 3,
  "attempt": 1,
  "stage": 3,
  "status": "complete",
  "kind": "tool_receipt",
  "publicTitle": "Parallel searched the current public web",
  "publicSummary": "The research tool completed a public-web search batch; source results still require evidence review.",
  "publicVisibility": "public",
  "toolName": "Parallel Search",
  "queryLabel": "project identity and creator coverage",
  "resultCount": 0,
  "sourceIds": [],
  "destination": "/research/run-junichiro-v1",
  "occurredAt": "2026-08-26T12:01:00Z"
}
